{
  "authoritySnapshotId": "authority_snapshot_kaveep_dev_agent_001",
  "schemaVersion": "1.0.0",
  "repositoryRoot": "C:/repositories/KAVEEP-DEV-AGENT",
  "authorityChain": [
    { "precedence": 1, "authorityType": "engineering_constitution", "ownerRepository": "KAVEEP-DEV-AGENT", "documentRef": "authority_document_engineering_constitution" },
    { "precedence": 2, "authorityType": "charter", "ownerRepository": "KAVEEP-DEV-AGENT", "documentRef": "authority_document_engineering_charter" }
  ],
  "authorityDocuments": [
    { "documentId": "authority_document_engineering_constitution", "path": "ENGINEERING-CONSTITUTION.md", "sha256": "aaaaaaaaaaaaaaaaaaaaaaaaaaaaaaaaaaaaaaaaaaaaaaaaaaaaaaaaaaaaaaaa", "bytes": 12000, "verificationStatus": "verified" },
    { "documentId": "authority_document_engineering_charter", "path": "ENGINEERING-CHARTER.md", "sha256": "bbbbbbbbbbbbbbbbbbbbbbbbbbbbbbbbbbbbbbbbbbbbbbbbbbbbbbbbbbbbbbbb", "bytes": 8000, "verificationStatus": "verified" }
  ],
  "limitations": ["Snapshot evidence does not create or replace authority."],
  "warnings": [],
  "evidenceRefs": ["evidence_authority_kaveep_dev_agent_001_001", "evidence_authority_kaveep_dev_agent_001_002"],
  "status": "verified",
  "createdAt": "2026-07-10T00:00:00.000Z"
}

